{
  "business_id": "biz_akosmicanimals",
  "name": "AKosmicAnimals",
  "mission": "Build profitable AI-first ecommerce brands with distinctive products.",
  "vision": "Operate a portfolio of scalable digital businesses using Hermes OS.",
  "owner": "AVANZIA",
  "status": "active",
  "created_at": "2026-07-19T09:00:00Z",
  "updated_at": "2026-07-19T09:00:00Z"
}